Brief ID,Priority,Target Query,Page Cluster,Search Intent,Primary Persona,Status,Original Data Needed,Owner,Due Date,Notes
BRIEF-0001,1,camping near Bangalore,City Landing Page,Local,First-time Camper,Briefed,"20 camper survey responses; 10 host leads; 5 candidate sites",Founder,,
BRIEF-0002,2,safe camping in India,Safety Hub,Informational,Family Camper,Briefed,"Safety survey; host verification criteria; emergency guidance",Founder,,
BRIEF-0003,3,where can I pitch a tent in India,Permission Guide,Informational,Own-Gear Camper,Briefed,"State policy links; legal review; permission checklist",Founder,,
BRIEF-0004,4,campervan stops India,Road Stop Hub,Road-Trip Utility,Road Traveler,Briefed,"20 candidate stops; amenity scores; route map notes",Founder,,
BRIEF-0005,5,host your land for camping,Host Acquisition,Host Acquisition,Host,Briefed,"10 host interviews; pricing ranges; founding host offer",Founder,,
BRIEF-0006,6,camping Coorg,Region Guide,Local,First-time Camper,Briefed,"15 estate leads; 5 host calls; monsoon notes",Founder,,
BRIEF-0007,7,camping Chikmagalur,Region Guide,Local,First-time Camper,Briefed,"10 estate leads; route stop notes",Founder,,
BRIEF-0008,8,camping Wayanad,Region Guide,Local,Road Traveler,Briefed,"10 Wayanad host leads; route stops; rain notes",Founder,,
